{
  "entity": "Synthetic Co",
  "period_start": "2026-01-01",
  "period_end": "2026-01-31",
  "as_of": "2026-02-01T09:00:00-05:00",
  "timezone": "America/New_York",
  "currency": "USD",
  "minor_units": 2,
  "accounting_basis": "accrual",
  "sources": [
    "source-id"
  ],
  "source_coverage": "complete synthetic fixture",
  "freshness": "as of synthetic timestamp",
  "reconciliation_status": "reconciled",
  "confirmed_facts": [
    "Synthetic fixture only"
  ],
  "source_observations": [],
  "calculations": [
    "Gross profit = 1000.00 - 400.00 = 600.00"
  ],
  "estimates": [],
  "assumptions": [],
  "inferences": [],
  "unknowns": [],
  "approvals": []
}
